{
  "$schema": "https://json-schema.org/draft/2020-12/schema",
  "$id": "urn:mosaic:protocol:schema:billing-state-webhook:v1:compatibility-manifest",
  "title": "Mosaic Billing State Webhook Contract v1 compatibility manifest",
  "description": "Machine-checked compatibility surface for Billing State Webhook Contract 1, including the deliberate producer/consumer asymmetry: producers are strict, consumers are tolerant. That asymmetry is an owner-approved exception to Mosaic's repo-wide fail-closed doctrine and is pinned here so it stays an exception rather than becoming a habit.",
  "type": "object",
  "additionalProperties": false,
  "required": [
    "billingStateWebhookContractVersion",
    "status",
    "schemas",
    "canonicalFixtures",
    "recordTypes",
    "eventTypes",
    "emittedEventTypes",
    "signing",
    "delivery",
    "limits",
    "producerPolicy",
    "consumerTolerance"
  ],
  "properties": {
    "billingStateWebhookContractVersion": {
      "const": "1"
    },
    "status": {
      "type": "string",
      "enum": [
        "draft",
        "releaseCandidate",
        "approved",
        "deprecated",
        "retired"
      ]
    },
    "deprecation": {
      "type": "object",
      "additionalProperties": false,
      "required": [
        "deprecatedAt",
        "retiresAt"
      ],
      "properties": {
        "deprecatedAt": {
          "type": "string",
          "pattern": "^[0-9]{4}-(0[1-9]|1[0-2])-([0-2][0-9]|3[01])$"
        },
        "retiresAt": {
          "type": "string",
          "pattern": "^[0-9]{4}-(0[1-9]|1[0-2])-([0-2][0-9]|3[01])$"
        },
        "supersededBy": {
          "type": "string",
          "minLength": 1,
          "maxLength": 128
        },
        "migrationGuide": {
          "type": "string",
          "minLength": 1,
          "maxLength": 256
        }
      }
    },
    "schemas": {
      "type": "object",
      "additionalProperties": false,
      "required": [
        "event",
        "delivery"
      ],
      "properties": {
        "event": {
          "$ref": "#/$defs/relativeJsonPath"
        },
        "delivery": {
          "$ref": "#/$defs/relativeJsonPath"
        }
      }
    },
    "canonicalFixtures": {
      "type": "array",
      "minItems": 10,
      "maxItems": 48,
      "uniqueItems": true,
      "items": {
        "$ref": "#/$defs/relativeJsonPath"
      }
    },
    "recordTypes": {
      "type": "array",
      "minItems": 2,
      "maxItems": 2,
      "uniqueItems": true,
      "items": {
        "$ref": "urn:mosaic:protocol:schema:billing-state-webhook:v1:event#/$defs/recordType"
      }
    },
    "eventTypes": {
      "description": "The complete closed event-type set, over-provisioned so the nine reserved names cost no contract version when they begin to be emitted.",
      "type": "array",
      "minItems": 10,
      "maxItems": 10,
      "uniqueItems": true,
      "items": {
        "$ref": "urn:mosaic:protocol:schema:billing-state-webhook:v1:event#/$defs/eventType"
      }
    },
    "emittedEventTypes": {
      "description": "The subset Mosaic actually emits at this contract's current status. Declaring a name in eventTypes is a promise about the vocabulary; listing it here is a promise about behaviour, and the two are deliberately different sizes.",
      "type": "array",
      "minItems": 1,
      "maxItems": 10,
      "uniqueItems": true,
      "items": {
        "$ref": "urn:mosaic:protocol:schema:billing-state-webhook:v1:event#/$defs/eventType"
      }
    },
    "signing": {
      "description": "The signature a consumer verifies before parsing anything. There is exactly one Mosaic webhook-signing scheme; a second one is never invented for a second event family.",
      "type": "object",
      "additionalProperties": false,
      "required": [
        "header",
        "algorithm",
        "signingVersion",
        "signedPayloadTemplate",
        "encoding",
        "timestampParameter",
        "signatureParameter",
        "multipleActiveSignatures",
        "replayWindowSeconds",
        "testEndpointSupported",
        "signatureVectors"
      ],
      "properties": {
        "header": {
          "const": "Mosaic-Signature"
        },
        "algorithm": {
          "const": "HMAC-SHA256"
        },
        "signingVersion": {
          "const": "v1"
        },
        "signedPayloadTemplate": {
          "description": "The exact bytes the MAC covers: the signing version, the timestamp, the event ID, and the raw request body, joined by full stops. The event ID is inside the signed payload so a valid signature cannot be replayed onto a different event, and the raw body is used verbatim because re-serializing the JSON changes the bytes.",
          "const": "{signingVersion}.{timestamp}.{eventId}.{rawBody}"
        },
        "encoding": {
          "const": "lowercase_hex"
        },
        "timestampParameter": {
          "const": "t"
        },
        "signatureParameter": {
          "const": "v1"
        },
        "multipleActiveSignatures": {
          "description": "During key rotation the header carries one v1 parameter per active key. A consumer accepts the request if any one of them verifies, so rotation never drops a delivery.",
          "const": true
        },
        "replayWindowSeconds": {
          "const": 300
        },
        "testEndpointSupported": {
          "const": true
        },
        "signatureVectors": {
          "description": "Repository-relative path to the cross-implementation signature vectors, so a verifier in any language can be checked against the same bytes.",
          "const": "packages/test-fixtures/src/webhook-signature-vectors.json"
        }
      }
    },
    "delivery": {
      "type": "object",
      "additionalProperties": false,
      "required": [
        "guarantee",
        "deduplicationKey",
        "orderingKey",
        "failureIsolation"
      ],
      "properties": {
        "guarantee": {
          "const": "atLeastOnce"
        },
        "deduplicationKey": {
          "const": "eventId"
        },
        "orderingKey": {
          "description": "Delivery order is not guaranteed. A consumer that has applied a higher snapshotVersion ignores a lower one; it never orders by createdAt or by arrival.",
          "const": "snapshotVersion"
        },
        "failureIsolation": {
          "description": "A webhook that cannot be delivered never rolls back the customer state that produced it. Delivery is a notification path, not a commit path.",
          "const": "deliveryNeverRollsBackState"
        }
      }
    },
    "limits": {
      "type": "object",
      "additionalProperties": false,
      "required": [
        "maxRecordBytes",
        "maxChangedEntitlementsPerEvent",
        "maxResponseExcerptCharacters",
        "maxDeliveryAttempts",
        "maxDiagnosticsPerRecord",
        "replayWindowSeconds"
      ],
      "properties": {
        "maxRecordBytes": {
          "const": 32768
        },
        "maxChangedEntitlementsPerEvent": {
          "const": 200
        },
        "maxResponseExcerptCharacters": {
          "const": 240
        },
        "maxDeliveryAttempts": {
          "const": 32
        },
        "maxDiagnosticsPerRecord": {
          "const": 10
        },
        "replayWindowSeconds": {
          "const": 300
        }
      }
    },
    "producerPolicy": {
      "description": "What Mosaic guarantees about what it emits. Producer schemas are strict in the ordinary Mosaic sense: closed enumerations, additionalProperties false, no provider material.",
      "type": "object",
      "additionalProperties": false,
      "required": [
        "unknownField",
        "unknownEventType",
        "providerSecret",
        "rawPurchaseToken",
        "rawProviderPayload",
        "eventIdStability",
        "exactlyOnceDelivery",
        "deliveryRecordTransport"
      ],
      "properties": {
        "unknownField": {
          "const": "rejectRecord"
        },
        "unknownEventType": {
          "const": "rejectRecord"
        },
        "providerSecret": {
          "const": "forbidden"
        },
        "rawPurchaseToken": {
          "const": "forbidden"
        },
        "rawProviderPayload": {
          "const": "forbidden"
        },
        "eventIdStability": {
          "const": "stableAcrossAttemptsAndReplays"
        },
        "exactlyOnceDelivery": {
          "const": "neverPromised"
        },
        "deliveryRecordTransport": {
          "description": "The delivery-attempt record is operator-facing. It is never transmitted to a destination.",
          "const": "neverSentToDestination"
        }
      }
    },
    "consumerTolerance": {
      "description": "An owner-approved documented exception to the repo-wide fail-closed doctrine. Everywhere else in Mosaic a reader that does not fully understand a document rejects it, because the alternative is rendering or granting something it misread. A webhook consumer is different: the event is not authoritative, the snapshot is. A consumer that rejected an event carrying a field it had not seen would stop reacting to real state changes in order to protect itself from information it was free to ignore. So consumers ignore what they do not recognize and re-read the snapshot, which is the same fail-safe outcome reached by the opposite route.",
      "type": "object",
      "additionalProperties": false,
      "required": [
        "unknownField",
        "unknownEventType",
        "unknownEnumerationMember",
        "authoritativeState",
        "ordering",
        "duplicateEvent",
        "signatureVerification"
      ],
      "properties": {
        "unknownField": {
          "const": "ignore"
        },
        "unknownEventType": {
          "const": "ignore"
        },
        "unknownEnumerationMember": {
          "const": "ignore"
        },
        "authoritativeState": {
          "const": "reReadSnapshot"
        },
        "ordering": {
          "const": "ignoreOlderSnapshotVersion"
        },
        "duplicateEvent": {
          "const": "deduplicateByEventId"
        },
        "signatureVerification": {
          "description": "The one thing a consumer must not be tolerant about. Verify the signature and the replay window before parsing the body at all.",
          "const": "requiredBeforeParsing"
        }
      }
    }
  },
  "$defs": {
    "relativeJsonPath": {
      "type": "string",
      "minLength": 1,
      "maxLength": 256,
      "pattern": "^\\.\\./\\.\\./.*\\.json$"
    }
  }
}
